{
    "$schema":  "../../../schemas/listing.schema.json",
    "schemaVersion":  1,
    "id":  "sidequest.reflection-probe-tools",
    "version":  "1.0.0",
    "name":  "SideQuest Reflection Probe Tools",
    "category":  "community-tool",
    "description":  "Finds the glossy surfaces in a scene, clusters them into capture points, and sizes each reflection probe\u0027s box, resolution, importance and blending against a cubemap memory budget. Probes you placed by hand are never modified.",
    "author":  {
                   "name":  "Elin",
                   "url":  "https://github.com/Ladypoly"
               },
    "license":  "MIT",
    "licensePath":  "packages/sidequest.reflection-probe-tools/1.0.0/LICENSE.txt",
    "instructionsPath":  "packages/sidequest.reflection-probe-tools/1.0.0/README.md",
    "sourceUrl":  "https://github.com/SideQuestVR/Creator-Community/tree/sidequest.reflection-probe-tools-v1.0.0/packages/sidequest.reflection-probe-tools/1.0.0/src",
    "compatibility":  {
                          "unity":  [
                                        "6000.3.21f1"
                                    ],
                          "creatorSdk":  [

                                         ],
                          "banterSdk":  [

                                        ]
                      },
    "dependencies":  [

                     ],
    "includesCode":  true,
    "scope":  "editor-only",
    "aiAssisted":  true,
    "testNotes":  "Tested in the Unity Editor on 6000.3.21f1 with URP 17.3.0, against generated fixture scenes (a four-room interior with doorways, mixed glossy/transparent/alpha-clipped materials and a movable prop, plus a 25-room 830-renderer stress scene). The full four-tool pipeline was run end to end: probes placed, occlusion classified and baked, reflection probes placed, lightmaps baked, and regression checks run afterwards.\n\nCompiles cleanly against 6000.4.3f1 as well, but has not been exercised in the Editor on that version.\n\nNOT tested: in-headset behaviour, multiplayer, Banter or Creator SDK integration, or any world actually shipped as an AssetBundle. Settings that the Banter client\u0027s own URP asset controls - reflection probe blending, box projection, the light probe system and additional-light limits - are reported as advisory only, because a world author cannot set them. Occlusion culling is verified by static flags and umbra data size, not by confirming in Play Mode that hidden renderers report isVisible false.",
    "download":  {
                     "path":  "packages/sidequest.reflection-probe-tools/1.0.0/SideQuestReflectionProbeTools-1.0.0.unitypackage",
                     "byteLength":  82224,
                     "sha256":  "52261b58b630844114e623198604112f8e9867d48ef329194310813e78a7ec90"
                 }
}
