{
    "$schema":  "../../../schemas/listing.schema.json",
    "schemaVersion":  1,
    "id":  "sidequest.lighting-core",
    "version":  "1.0.0",
    "name":  "SideQuest Lighting Core",
    "category":  "community-tool",
    "description":  "Shared scene analysis for the SideQuest lighting tools: renderer and material facts, URP pipeline facts, room segmentation, and the JSON report/plan handshake the other four packages build on. Useful on its own for reading a scene; it changes nothing by itself.",
    "author":  {
                   "name":  "Elin",
                   "url":  "https://github.com/Ladypoly"
               },
    "license":  "MIT",
    "licensePath":  "packages/sidequest.lighting-core/1.0.0/LICENSE.txt",
    "instructionsPath":  "packages/sidequest.lighting-core/1.0.0/README.md",
    "sourceUrl":  "https://github.com/SideQuestVR/Creator-Community/tree/sidequest.lighting-core-v1.0.0/packages/sidequest.lighting-core/1.0.0/src",
    "compatibility":  {
                          "unity":  [
                                        "6000.3.21f1"
                                    ],
                          "creatorSdk":  [

                                         ],
                          "banterSdk":  [

                                        ]
                      },
    "dependencies":  [

                     ],
    "includesCode":  true,
    "scope":  "editor-only",
    "aiAssisted":  true,
    "testNotes":  "Tested in the Unity Editor on 6000.3.21f1 with URP 17.3.0, against generated fixture scenes (a four-room interior with doorways, mixed glossy/transparent/alpha-clipped materials and a movable prop, plus a 25-room 830-renderer stress scene). The full four-tool pipeline was run end to end: probes placed, occlusion classified and baked, reflection probes placed, lightmaps baked, and regression checks run afterwards.\n\nCompiles cleanly against 6000.4.3f1 as well, but has not been exercised in the Editor on that version.\n\nNOT tested: in-headset behaviour, multiplayer, Banter or Creator SDK integration, or any world actually shipped as an AssetBundle. Settings that the Banter client\u0027s own URP asset controls - reflection probe blending, box projection, the light probe system and additional-light limits - are reported as advisory only, because a world author cannot set them. Occlusion culling is verified by static flags and umbra data size, not by confirming in Play Mode that hidden renderers report isVisible false.",
    "download":  {
                     "path":  "packages/sidequest.lighting-core/1.0.0/SideQuestLightingCore-1.0.0.unitypackage",
                     "byteLength":  62524,
                     "sha256":  "48eeec7f3df5fcd0eed494e99906669d75f75ef7a7901b05b257dcecf617f8b8"
                 }
}
