{
  "$schema": "../schemas/listing.schema.json",
  "schemaVersion": 1,
  "id": "example.spawn-marker",
  "version": "1.0.0",
  "name": "Example Spawn Marker",
  "category": "prefab",
  "description": "Structural example only. No package is supplied or approved.",
  "author": { "name": "Example author" },
  "license": "LicenseRef-Choose-A-License",
  "licensePath": "packages/example.spawn-marker/1.0.0/LICENSE.txt",
  "instructionsPath": "packages/example.spawn-marker/1.0.0/README.md",
  "compatibility": { "unity": [], "creatorSdk": [], "banterSdk": [] },
  "dependencies": [],
  "includesCode": false,
  "scope": "runtime",
  "testNotes": "Not tested. Replace this example with actual version-specific results."
}
